,type,affiliation
1758,university,"""Department of Biology, The Hong Kong University of Science and Technology, Clear Water Bay, Kowloon, Hong Kong SAR, China."""
1759,private,"""Division of Infectious Disease, Key Laboratory of Surveillance and Early Warning on Infectious Disease, Chinese Center for Disease Control and Prevention."""
1760,university,"""Department of Pathology, Immunology and Laboratory Medicine, University of Florida College of Medicine, Gainesville, FL 32610, USA. ostroda@pathology.ufl.edu."""
1761,university,"""Department of Pathology, Microbiology and Immunology, Vanderbilt University Medical Centre, Nashville, TN, USA. sebastian.joyce@vumc.org."""
1762,hospital,"""Nuffield Department of Medicine, John Radcliffe Hospital, Oxford, UK."""
1763,private,"""Facility for Biotechnology Resources, Center for Biologics Evaluation and Research, US Food and Drug Administration, Silver Spring, MD 20993, USA."""
1764,university,"""3P5 proteom&#x27;IC facility, Universit\xc3\xa9 de Paris, Institut Cochin, INSERM U1016, CNRS-UMR 8104, Paris, France."""
1765,university,"""Department of Biochemistry and Genetics, La Trobe Institute of Molecular Science, La Trobe University, Bundoora, 3084, VIC, Australia."""
1766,university,"""Department of Neurosurgery, Johns Hopkins University School of Medicine, Baltimore, MD, USA."""
1767,university,"""School of Life Sciences, Zhengzhou University, Zhengzhou, 450001, China. gaoyf29@mail.sysu.edu.cn."""
1768,university,"""Department of Hematology, School of Medicine, Fujita Health University, Toyoake, Japan."""
1769,institute,"""Division of Biochemistry, The Netherlands Cancer Institute, Plesmanlaan 121, 1066 CX, Amsterdam, The Netherlands."""
1770,university,"""Section for Immunology and Vaccinology, National Veterinary Institute, Technical University of Denmark, Copenhagen, Denmark."""
1771,university,"""Department of Immunology, Imperial College London, London, UK."""
1772,university,"""Department of Oncology, Johns Hopkins University School of Medicine, Baltimore, Maryland 21287 gabelli@jhmi.edu."""
1773,university,"""Anthony Nolan Research Institute, The Royal Free and University College Medical School, London, United Kingdom."""
1774,university,"""Institute of Neuroscience and Translational Medicine, Zhoukou Normal University, Zhoukou, People&#x27;s Republic of China."""
1775,hospital,"""Jiangsu Province Key Laboratory of Critical Care Medicine, Department of Critical Care Medicine, Zhongda Hospital, Medical School of Southeast University, Nanjing, 210009, Jiangsu, China. chuanlaishen@seu.edu.cn."""
1776,private,"""Laboratory of Clinical and Experimental Endocrinology, KU Leuven, Leuven, Belgium."""
1777,university,"""Center for Virology, Medical University of Vienna, Vienna, Austria."""
1778,university,"""Center for Biological Sequence Analysis, BioCentrum-DTU, Technical University of Denmark, Lyngby, Denmark."""
1779,hospital,"""Cancer Immunobiology, Olivia Newton-John Cancer Research Institute, Austin Hospital, Heidelberg, Victoria, Australia."""
1780,institute,"""Institut National de la Sante et de la Recherche Medicale Unite 396, Institut Biomedical des Cordeliers, Paris, France."""
1781,private,"""Early Drug Development Service, Memorial Sloan Kettering Cancer Center, New York, NY, USA."""
1782,private,"""Innovative Targeting Solutions, Vancouver, BC, Canada."""
1783,university,"""Department of Biochemistry, University of Illinois, 600 S. Matthews Ave., Urbana, IL 61801, USA."""
1784,university,"""Department of Infectious Diseases, Leiden University Medical Center, Leiden 2333 ZA, The Netherlands. ageluk@lumc.nl"""
1785,private,"""MyeloPro Diagnostics and Research, Vienna, Austria."""
1786,institute,"""Biological Resources Branch, National Institute of Allergy and Infectious Disease, National Institutes of Health, Bethesda, MD 20892."""
1787,hospital,"""Department of Neurooncology, University Hospital Heidelberg and National Center for Tumor Diseases, 69120 Heidelberg, Germany."""
1788,private,"""Sanquin, Amsterdam, The Netherlands."""
1789,institute,"""Koch Institute at MIT, Cambridge, United States."""
1790,private,"""Immunotope, Inc., Doylestown, PA 18902, USA."""
1791,institute,"""Dept. of Molecular Biology, Rajendra Memorial Research Institute of Medical Sciences, Patna, 800007, India."""
1792,institute,"""CAS Key Laboratory of Pathogenic Microbiology and Immunology, Institute of Microbiology, Chinese Academy of Sciences (CAS), Beijing, China."""
1793,private,"""Clinical Cooperation Unit Translational Immunology, German Cancer Consortium (DKTK), DKFZ partner site T\xc3\xbcbingen, T\xc3\xbcbingen, Germany."""
1794,university,"""From the University of Maryland Institute for Bioscience and Biotechnology Research, W. M. Keck Laboratory for Structural Biology, Rockville, Maryland 20850, Department of Cell Biology and Molecular Genetics, University of Maryland, College Park, Maryland 20742, rmariuzz@umd.edu."""
1795,institute,"""Laboratory of Tumor Cell Biology, National Institutes of Health, Bethesda, Maryland 20892, USA."""
1796,private,"""Seqirus, Parkville, Victoria, Australia."""
1797,institute,"""Parker Institute for Cancer Immunotherapy, New York, NY, USA. chandrs1@mskcc.org."""
1798,hospital,"""Laboratory of Molecular Neuro-Oncology, Department of Neurology, Clinical Neuroscience Center, University Hospital Zurich and University of Zurich, Frauenklinikstrasse 26, 8091, Zurich, Switzerland."""
1799,university,"""From the Departments of Immunohematology and Blood Transfusion and."""
1800,institute,"""Cancer Research UK Institute for Cancer Studies, Edgbaston, Birmingham B15 2TT, United Kingdom."""
1801,university,"""Australian Research Council Centre of Excellence for Advanced Molecular Imaging, Monash University, Clayton, VIC, 3800, Australia. jamie.rossjohn@monash.edu."""
1802,university,"""Nuffield Department of Medicine, University of Oxford, Oxford, United Kingdom."""
1803,university,"""Department of Infectious Diseases, Sahlgrenska Academy, University of Gothenburg, S-413 46 Gothenburg, Sweden."""
1804,private,"""Immunitrack, Copenhagen, Denmark."""
1805,private,"""Vaccine Research Unit, Pfizer Global Research and Development, Sandwich, Kent, CT13-9NJ, UK. paul.cockle@pfizer.com."""
1806,university,"""Center for Systems Medicine, Institute of Basic Medical Sciences, Chinese Academy of Medical Sciences and Peking Union Medical College, Beijing, China."""
1807,institute,"""NHC Key Laboratory of Medical Virology and Viral Diseases, National Institute for Viral Disease Control and Prevention, Chinese Center for Disease Control and Prevention, Beijing, China."""
1808,university,"""Institut f\xc3\xbcr Kristallographie, Freie Universit\xc3\xa4t Berlin, 14195 Berlin, Germany."""
1809,university,"""Department of Environment and Prevention Sciences, University of Ferrara, 44123 Ferrara, Italy."""
1810,private,"""Netherlands Proteomics Centre, Padualaan 8, 3584 CH Utrecht, The Netherlands."""
1811,university,"""Department of Chemistry and Biochemistry and the Harper Cancer Research Institute, University of Notre Dame, Notre Dame, IN, USA."""
1812,university,"""Department of Microbiology, Tumor and Cell Biology, Karolinska Institute, Stockholm, Sweden."""
1813,university,"""School of Life Sciences, Zhengzhou University, Zhengzhou, 450001, China. yahongwu@zzu.edu.cn."""
1814,university,"""Liver Unit, Cl\xc3\xadnica Universidad de Navarra, Pamplona, Spain."""
1815,institute,"""Translational Research Program, Benaroya Research Institute, Seattle, Washington, United States of America."""
1816,private,"""Deepdene Surgery, Deepdene, VIC, 3103, Australia."""
1817,private,"""Animal Facility, Istituto Nazionale per lo Studio e la Cura dei Tumori, &quot;Fondazione Pascale&quot;-IRCCS, 80131, Naples, Italy."""
1818,institute,"""Division of Inflammation Biology, La Jolla Institute for Allergy and Immunology, La Jolla, CA, United States."""
1819,university,"""Centre for Cancer Immunology and Institute for Life Sciences, Faculty of Medicine, University of Southampton, Southampton SO16 6YD, UK."""
1820,institute,"""Division of Immunology, Aichi Cancer Center Research Institute, 1-1 Kanokoden, Chikusa-ku, Nagoya 464-8681, Japan."""
1821,university,"""Department of Surgery, University of Chicago, Chicago, Illinois, USA; Department of Surgery, Yale University School of Medicine, New Haven, Connecticut, USA;"""
1822,hospital,"""Department of Neuroscience, Central Clinical School, Alfred Hospital, Monash University, Melbourne, VIC, Australia."""
1823,university,"""Molecular and Integrative Neurosciences Department, The Scripps Research Institute, SP30-2020, 10550 North Torrey Pines Road, La Jolla, CA 92037, USA. jbotten@scripps.edu"""
1824,institute,"""Surgery Branch, National Cancer Institute, NIH, Bethesda, Maryland 20892-1502, USA. Maria_Parkhurst@nih.gov"""
1825,private,"""Hubei Provincial Center for Disease Control and Prevention, Wuhan, Hubei, China."""
1826,university,"""Department of Medicine, University of Vermont College of Medicine, Burlington, VT 05405, USA. jbotten@uvm.edu"""
1827,private,"""Immunology and Microbial Pathogenesis Program, Weill Cornell Medicine, New York, NY."""
1828,university,"""Department of Surgery, University of Chicago, Chicago, Illinois, USA;"""
1829,university,"""School of Biochemistry, University of Bristol, Biomedical Sciences Building, University Walk, Bristol, BS8 1TD, UK."""
1830,institute,"""Broad Institute of MIT and Harvard, Cambridge, MA, USA. derin_keskin@dfci.harvard.edu."""
1831,university,"""Department of Collaboration and Education, Hokkaido University Research Center for Zoonosis Control, Sapporo, Japan."""
1832,university,"""Department of Biology, Technion, Israel Institute of Technology, 32000, Haifa , Israel. admon@tx.technion.ac.il."""
1833,university,"""From the \xe2\x80\xa1Ludwig Institute for Cancer Research, University of Lausanne, 1066 Epalinges, Switzerland."""
1834,hospital,"""Liver Research Unit, Chang Gung Memorial Hospital, Chang Gung University College of Medicine, Taipei, Taiwan."""
1835,university,"""Cardiff University School of Medicine, Heath Park, Cardiff, United Kingdom."""
1836,university,"""Infection and Immunity Program and the Department of Biochemistry and Molecular Biology, Biomedicine Discovery Institute, Monash University, Clayton, Victoria 3800, Australia."""
1837,hospital,"""Vaccine and Immunotherapy Center, Massachusetts General Hospital, Boston, MA, United States."""
1838,institute,"""Division of Parasitic Diseases, National Center for Infectious Diseases, Centers for Disease Control and Prevention, Atlanta, GA 30341-3724, USA. Kumar@FORM-NET.COM"""
1839,hospital,"""Endocrinology Division, Linyi People&#x27;s Hospital, Linyi 276000, China. shufali@163.com"""
1840,university,"""Department of Health Technology, Technical University of Denmark, 2800, Lyngby, Denmark."""
1841,university,"""KG Jebsen Centre for Autoimmune Diseases, University of Bergen, Bergen, Norway."""
1842,university,"""Infection and Immunity Program and Department of Biochemistry and Molecular Biology, Biomedicine Discovery Institute, Monash University, Clayton, VIC, 3800, Australia."""
1843,institute,"""Institute of Biophysics, Chinese Academy of Sciences, Beijing, China."""
1844,university,"""Department of Chemistry and Chemical Engineering, California Institute of Technology, Pasadena, CA 91125, USA; Materials and Process Simulation Center, California Institute of Technology, Pasadena, CA 91125, USA; Institute for Systems Biology, Seattle, WA 98109, USA."""
1845,university,"""Institute for Transfusion Medicine, Hannover Medical School, Carl-Neuberg-Str. 1, 30625 Hannover, Germany."""
1846,university,"""Department of Pediatrics, University of Colorado Denver School of Medicine, Aurora, CO, 80045, USA."""
1847,university,"""Laboratory of Applied Structural Biology, Division of Applied Life Sciences, Graduate School of Agriculture, Kyoto University, Gokasho, Uji, Kyoto 611-0011, Japan."""
1848,university,"""Griffith University, Brisbane, Queensland, Australia."""
1849,university,"""Jake Gittlen Cancer Research Foundation, Department of Pathology, Pennsylvania State University college of medicine, Hershey, PA 17033, USA."""
1850,institute,"""Dendritic Cell Program, Mater Medical Research Institute, Level 3 Aubigny Place, South Brisbane, QLD, 4101, Australia."""
1851,university,"""Department of Immunology, Weifang Medical University, Weifang, China."""
1852,institute,"""Institut de Recerca Sant Joan de Deu, Barcelona, Spain."""
1853,university,"""Department of Microbiology and Immunology, City University of New York Medical School, New York, NY 10031, USA."""
1854,university,"""Klinik und Poliklinik f\xc3\xbcr Innere Medizin III, Klinikum rechts der Isar der Technischen Universit\xc3\xa4t M\xc3\xbcnchen, M\xc3\xbcnchen, Germany angela.krackhardt@tum.de."""
1855,university,"""Pharmacology Division, Department of Urology, Transplantation Unit, National Cancer Center, Chuo-ku, Tokyo, Japan."""
1856,university,"""Dermatology Unit, NESMOS Department, Sapienza University of Rome, 00100 Rome, Italy."""
1857,university,"""Immunology and Immunotherapy, Centro de Investigaci\xc3\xb3n M\xc3\xa9dica Aplicada (CIMA), Universidad de Navarra, Pamplona, Spain."""
1858,university,"""Department of Microbiology and Immunology, University of Melbourne, 3010, Melbourne, Vic., Australia."""
1859,private,"""From the Division for Cell Biology and."""
1860,university,"""Division of Infection and Immunity, School of Medicine, Cardiff University, UK."""
1861,university,"""Department of Immunology, Institute of Cell Biology, University of Tuebingen, Tuebingen, Germany."""
1862,university,"""Department of Molecular Oncology &amp; Immunology, Oncode Institute, The Netherlands Cancer Institute, Amsterdam, the Netherlands."""
1863,private,"""Marie-Jos\xc3\xa9e and Henry R. Kravis Center for Molecular Oncology, Memorial Sloan Kettering Cancer Center, New York, NY, USA."""
1864,private,"""Human Oncology and Pathogenesis Program (HOPP), Immuno-Oncology Service, Memorial Sloan Kettering Cancer Center, New York, NY, USA."""
1865,university,"""Departments of Biology and Computer Science, Humboldt-Universit\xc3\xa4t zu Berlin, Unter den Linden 6, 10099, Berlin, Germany."""
1866,institute,"""CAS Key Laboratory of Pathogenic Microbiology and Immunology, Institute of Microbiology, Chinese Academy of Sciences, Beijing 100101, PR China. Electronic address: tienpo@sun.im.ac.cn."""
1867,university,"""Department of Surgery, Immunogenetics and Transplantation Laboratory, University of California, San Francisco, San Francisco, CA."""
1868,university,"""Swammerdam Institute for Life Sciences University of Amsterdam Amsterdam The Netherlands."""
1869,university,"""Department of Biochemistry and Molecular Biology, Harvard University, Cambridge, MA 02138."""
1870,hospital,"""Department of Pathology, Southwest Hospital, Third Military Medical University, Chongqing 400038, China."""
1871,private,"""Equipe Labellis\xc3\xa9e par la Fondation pour la Recherche M\xc3\xa9dicale, FRM."""
1872,university,"""1Jenner Institute, University of Oxford, Oxford, OX3 7DQ UK."""
1873,private,"""Avidex Limited, Abingdon, Oxon, OX14 4RX, UK."""
1874,institute,"""State Key Laboratory of Cell Biology, Shanghai Key Laboratory of Molecular Andrology, Shanghai Institute of Biochemistry and Cell Biology, CAS Center for Excellence in Molecular Cell Science, Chinese Academy of Sciences, Shanghai, 200031, China."""
1875,university,"""Biotechnology Institute Thurgau (BITg) at the University of Konstanz, Kreuzlingen, Switzerland."""
1876,university,"""Rheumatology Division, Department of Medicine, Washington University School of Medicine, St Louis, MO, USA."""
1877,university,"""Institute for infection and immunity, St George&#x27;s, University of London, London, UK."""
1878,university,"""Institute of Molecular Oncology and Functional Genomics, TUM School of Medicine, Klinikum rechts der Isar der Technischen Universit\xc3\xa4t M\xc3\xbcnchen, M\xc3\xbcnchen, Germany."""
1879,university,"""2Department of Science and Technology, Universita&#x27; degli Studi del Sannio, 82100 Benevento, Italy."""
1880,university,"""Department of Medical Genetics, The Second Military Medical University, Shanghai, People&#x27;s Republic of China."""
1881,university,"""Menzies School of Health Research, Darwin, Australia."""
1882,university,"""Institut f\xc3\xbcr Immungenetik, Charit\xc3\xa9, Humboldt-Universit\xc3\xa4t zu Berlin, Spandauer Damm 130, 14050 Berlin, Germany."""
1883,university,"""Department of Bio and Health Informatics, Technical University of Denmark, Lyngby, Denmark."""
1884,hospital,"""Institute of Liver Studies, King&#x27;s College London School of Medicine at King&#x27;s College Hospital, Denmark Hill, London, UK."""
1885,hospital,"""Victorian Infectious Diseases Service, The Royal Melbourne Hospital, at the Peter Doherty Institute for Infection and Immunity, Parkville, VIC, 3050, Australia."""
1886,university,"""Departments of Pediatrics, Medicine and Pathology, University of Colorado Anschutz Medical Campus, Aurora, Colorado, United States of America."""
1887,university,"""Department of Oncology UNIL CHUV, Ludwig Institute for Cancer Research, University of Lausanne, 1005, Lausanne, Switzerland."""
1888,hospital,"""Department of Infectious Diseases, Union Hospital, Tongji Medical College, Huazhong University of Science and Technology, Wuhan, China."""
1889,private,"""BCN Peptides SA, Barcelona, Spain."""
1890,university,"""Faculty of Medicine, The University of Queensland, Herston, QLD, 4006, Australia."""
1891,institute,"""Division of Molecular Oncology and Immunology, Netherlands Cancer Institute, 1066 CX Amsterdam, the Netherlands."""
1892,hospital,"""National Institute for Health Research, Biomedical Research Centre at Guy&#x27;s and St. Thomas&#x27; Hospital Foundation Trust and King&#x27;s College London, London, U.K."""
1893,university,"""Center for Systems Medicine, Institute of Basic Medical Sciences, Chinese Academy of Medical Sciences and Peking Union Medical College, Beijing, China wap@ism.cams.cn gaof@im.ac.cn liujun@ivdc.chinacdc.cn."""
1894,university,"""Department of Pathology, Sapporo Medical University, Sapporo, Japan. kanaseki@sapmed.ac.jp."""
1895,private,"""EpiVax Inc., Providence, RI, United States."""
1896,university,"""Department of Medical Sciences, University of Turin, Turin, Italy."""
1897,university,"""Department of Biochemistry and Molecular Biology, Pharmaceutical Sciences, and Morphology and Embryology, University of Ferrara, Ferrara, Italy."""
1898,university,"""Department of Medical Oncology and Cancer Biology, Dana-Farber Cancer Institute, Harvard Medical School, Boston, MA 02215, USA."""
1899,institute,"""\xc2\xa7Faculty of Biology, Technion-Israel Institute of Technology, Haifa 32000, Israel."""
1900,university,"""NMI Natural and Medical Sciences Institute at the University of T\xc3\xbcbingen, Markwiesenstrasse 55, 72770 Reutlingen, Germany."""
1901,university,"""State Key Laboratory of Quality Research in Chinese Medicine, Institute of Chinese Medical Sciences, University of Macau, Macau, Macau SAR, China."""
1902,institute,"""Division of Medical Oncology, Institut National de la Sant\xc3\xa9 et de la Recherche M\xc3\xa9dicale Unit\xc3\xa9 d&#x27;Immunit\xc3\xa9 Cellulaire Antivirale, Institut Pasteur, Paris, France. francini@unisi.it"""
1903,university,"""From the Department of Microbiology and Immunology, University of Melbourne at the Peter Doherty Institute for Infection and Immunity, Parkville, Victoria 3010, Australia."""
1904,university,"""Department of Neurological Surgery, University of California, San Francisco, San Francisco, CA hideho.okada@ucsf.edu."""
1905,institute,"""Unit\xc3\xa9 d&#x27;Immunit\xc3\xa9 Cellulaire Antivirale, D\xc3\xa9partement d&#x27;Immunologie, Institut Pasteur, France."""
1906,university,"""Department of Pharmaceutical Analysis and Analytical Chemistry, College of Pharmacy, Third Military Medical University, Chongqing 400038, China. Electronic address: zhangmengjunyy@126.com."""
1907,hospital,"""Children&#x27;s Hospital, Pediatric Hematology, Oncology and Stem Cell Transplantation, University of W\xc3\xbcrzburg, W\xc3\xbcrzburg, Germany."""
1908,private,"""Facility for Biotechnology Resources, Center for Biologics Evaluation and Research, Food and Drug Administration, Silver Spring, MD, United States."""
1909,university,"""The Howard Hughes Medical Institute, Stanford University School of Medicine, Stanford, CA, USA. kcgarcia@stanford.edu."""
1910,university,"""Department of Microbiology and Immunology, Institute of Geriatric Immunology, School of Medicine, Jinan University, Guangzhou, China."""
1911,hospital,"""Nuffield Department of Clinical Medicine, John Radcliffe Hospital, Oxford, United Kingdom. l.barber@rfc.ucl.ac.uk"""
1912,private,"""Proteomics Unit, Spanish National Biotechnology Centre, Madrid, Spain."""
1913,hospital,"""Pierre et Marie Curie Paris 6 University, Sorbonne Paris Cit\xc3\xa9, D\xc3\xa9partement Hospitalo-Universitaire FAST, CR7, Centre d&#x27;Immunologie et des Maladies Infectieuses (CIMI-Paris), Paris, France."""
1914,university,"""Department of Tumour Biology, Institute of Medical Science, University of Tokyo, Japan."""
1915,hospital,"""\xc2\xb6Guangdong Key Laboratory for emerging infectious diseases, Shenzhen Key Laboratory of Infection and Immunity, Shenzhen Third People&#x27;s Hospital, Guangdong Medical College, Shenzhen, 518020, China;"""
1916,university,"""Department of Microbiology and Immunology, Shanghai Institute of Immunology, Shanghai Jiao Tong University School of Medicine, Shanghai, China."""
1917,university,"""Ludwig Center, Sidney Kimmel Comprehensive Cancer Center, Johns Hopkins University School of Medicine, Baltimore, MD 21287, USA."""
1918,university,"""Department of Microbiology, National University of Singapore, Singapore Immunology Programme, National University of Singapore, Singapore."""
1919,hospital,"""Institute of Virology, University Hospital, University of Duisburg-Essen, Essen, Germany."""
1920,university,"""Society of Fellows, Harvard University, Cambridge, MA, USA."""
1921,university,"""Department of Medical Microbiology, Xiangya School of Medicine, Central South University, Changsha, China."""
1922,university,"""Institute of Biochemistry, Biocenter, Goethe University Frankfurt, Max-von-Laue-Strasse 9, D-60438 Frankfurt/Main, Germany."""
1923,institute,"""Suzhou Institute of Systems Medicine, Suzhou, China."""
1924,institute,"""Swiss Institute of Bioinformatics, Basel, 4053, Basel, Switzerland. frederik.otzen.bagger@regionh.dk."""
1925,university,"""Department of Microbiology and Immunology , Dalhousie University , Halifax , Nova Scotia B3H 4R2 , Canada."""
1926,hospital,"""Chris O&#x27;Brien Lifehouse Cancer Centre, Royal Prince Alfred Hospital, Camperdown, New South Wales, Australia."""
1927,hospital,"""Division of Infectious Diseases and Hospitalist Program, Department of Medicine, School of Medicine, University of California Irvine, Irvine, CA."""
1928,hospital,"""Department of Oncology, Lausanne University Hospital (CHUV), Lausanne, Switzerland. Electronic address: silvia.fuertes@chuv.ch."""
1929,university,"""John van Geest Cancer Research Centre, Nottingham Trent University, Nottingham NG11 8NS, UK."""
1930,institute,"""Division of Vaccine Discovery, La Jolla Institute for Allergy and Immunology, La Jolla, California 92037."""
1931,university,"""Dipartimento di Biochimica e Biologia Molecolare, Universit\xc3\xa0 di Ferrara, Ferrara, Italy."""
1932,university,"""Department of Biomolecular Engineering, University of California, Santa Cruz, Santa Cruz, CA, United States."""
1933,university,"""Division of Structural Biology, Wellcome Centre for Human Genetics, Roosevelt Drive, University of Oxford, Oxford, OX3 7BN, UK."""
1934,university,"""Department of Medicine, University of California, San Diego, San Diego, CA 92122."""
1935,university,"""Department of Immunohematology and Blood Bank, Leiden University Medical Center, The Netherlands."""
1936,university,"""Division of Immunology, Department of Biology, University of Konstanz, Konstanz, Germany."""
1937,university,"""Department of Medicine II, University of Freiburg, Freiburg, Germany; Faculty of Biology, University of Freiburg, Freiburg, Germany."""
1938,university,"""Department of Respiratory Medicine and Allergology, Sapporo Medical University, Sapporo, Hokkaido, Japan."""
1939,university,"""School of Chinese Medicine, Li Ka Shing (LKS) Faculty of Medicine, the University of Hong Kong, Hong Kong, Hong Kong SAR, China."""
1940,institute,"""Institute of Medical Microbiology, Immunology and Hygiene, Munich, Germany."""
1941,university,"""Department of Urology, Emory University School of Medicine, Atlanta, GA, USA."""
1942,university,"""Department of Molecular and Cellular Physiology, Stanford University School of Medicine, Stanford, CA."""
1943,university,"""Monash Centre for Data Science, Faculty of Information Technology, Monash University, Melbourne, Victoria 3800, Australia."""
1944,university,"""Department of Diabetes Immunology, Diabetes &amp;Metabolism Research Institute at the Beckman Diabetes Research Institute, City of Hope, Duarte, California, USA."""
1945,institute,"""CAS Key Laboratory of Pathogenic Microbiology and Immunology, Institute of Microbiology, Chinese Academy of Sciences (CAS), Beijing, China wap@ism.cams.cn gaof@im.ac.cn liujun@ivdc.chinacdc.cn."""
1946,university,"""Department of Microbiology, University of Virginia, Charlottesville 22908, USA."""
1947,university,"""Department of Paediatric Haematology and Oncology, Hannover Medical School, Carl-Neuberg-Strasse 1, 30625, Hannover, Germany."""
1948,university,"""Division of Medical Oncology, Department of Medicine, University of Washington, Seattle, WA, USA."""
