,type,affiliation
884,university,"""Institute of Molecular Systems Biology, Department of Biology, ETH Zurich, Zurich, Switzerland."""
885,university,"""Centre for Therapeutic Innovation, University of Bath, UK."""
886,university,"""School of Life Science and Technology, ShanghaiTech University, Shanghai, 201210, China."""
887,university,"""Henan Key Laboratory of Bioactive Macromolecules, Zhengzhou University, Zhengzhou, 450001, China."""
888,institute,"""Dept. of Clinical Medicine, Rajendra Memorial Research Institute of Medical Sciences, Patna, 800007, India."""
889,university,"""Division of Infection &amp; Immunity, Cardiff University, Cardiff, CF14 4XN, UK."""
890,university,"""Institut National de Sant\xc3\xa9 et de Recherche M\xc3\xa9dicale U561 et Universit\xc3\xa9 Paris N, H\xc3\xb4pital Cochin-Saint Vincent de Paul, Paris, France."""
891,university,"""Systems Immunity Research Institute, Cardiff University, Cardiff, UK."""
892,private,"""Epimmune, San Diego, CA 92121, USA. jalexander@epimmune.com"""
893,university,"""Laboratory of Cellular and Molecular Immunology, Gavin Herbert Eye Institute, School of Medicine, University of California Irvine, Irvine, CA."""
894,university,"""Department of Genetics and Pathology, International Hereditary Cancer Center, Pomeranian Medical University, ul. Rybacka 1, 70-204, Szczecin, Poland."""
895,private,"""Molecular Pharmacology Program, Memorial Sloan Kettering Cancer Center, New York, New York."""
896,institute,"""Institute for Medical and Engineering Sciences, Massachusetts Institute of Technology, Cambridge MA 02139 USA."""
897,university,"""Infection and Immunity Program, Biomedicine Discovery Institute, Monash University, Clayton, Victoria 3800, Australia Department of Biochemistry and Molecular Biology, Monash University, Clayton, Victoria 3800, Australia Australian Research Council Centre of Excellence in Advanced Molecular Imaging, Monash University, Clayton, Victoria 3800, Australia jamie.rossjohn@monash.edu agbrooks@unimelb.edu.au julian.vivian@monash.edu."""
898,university,"""Computational Structural Biology, Bijvoet Center for Biomolecular Research, Utrecht University, Padualaan 8, 3584 CH Utrecht, The Netherlands."""
899,university,"""Department of Clinical Immunology, University of Birmingham, Birmingham, United Kingdom."""
900,university,"""Department of Biochemistry and Molecular Biology, Protein Crystallography Unit, School of Biomedical Sciences, Monash University, Clayton, Australia."""
901,university,"""Laboratory of Cellular and Molecular Immunology, Gavin Herbert Eye Institute, University of California, Irvine, School of Medicine, Irvine, CA 92697."""
902,institute,"""National Jewish Medical and Research Center, Denver, CO, United States."""
903,university,"""Center for AIDS Research, Kumamoto University, Kumamoto, Japan masafumi@kumamoto-u.ac.jp."""
904,university,"""School of Biology, University of St Andrews, St Andrews, UK."""
905,institute,"""Centre for Infectious Disease Control, National Institute for Public Health and the Environment , P.O. Box 1, 3720 BA Bilthoven, The Netherlands."""
906,university,"""Department of Medical Genetics, College of Basic Medical Sciences, Second Military Medical University, Xiangyin Road 800, Shanghai 200433, China."""
907,institute,"""The Ragon Institute of MGH, MIT and Harvard, Cambridge, Massachusetts 02139, USA."""
908,university,"""Institute for Molecular Bioscience, University of Queensland, Brisbane, Australia."""
909,hospital,"""Institute of Neuroscience and Department of Neurology of the Second Affiliated Hospital of Guangzhou Medical University, Key Laboratory of Neurogenetics and Channelopathies of Guangdong Province and the Ministry of Education of China, Guangzhou 510260, China. Electronic address: stoneyiwu@gzhmu.edu.cn."""
910,university,"""Systems Immunology Research Institute, Cardiff University, CF14 4XN Cardiff, Wales, UK; School of Biosciences, Cardiff University, CF10 3AX Cardiff, Wales, UK; Pathogen genomics Unit, Public Health Wales NHS Trust, CF14 4XW Cardiff, Wales, UK. Electronic address: connortr@cardiff.ac.uk."""
911,hospital,"""Molecular Immunology Group, Nuffield Department of Clinical Medicine, Institute of Molecular Medicine, John Radcliffe Hospital, Oxford, UK."""
912,university,"""Institute for Transfusion Medicine, Hannover Medical School, Medical Park, Feodor Lynen Street 21, 30625 Hannover, Germany."""
913,university,"""Department of Biochemistry and Molecular Biology, School of Biomedical Sciences, Monash University, Clayton, Victoria 3800, Australia; Australian Research Council Centre of Excellence in Advanced Molecular Imaging, Monash University, Clayton, Victoria 3800, Australia;"""
914,hospital,"""Deparment of Gastroenterology, Shanghai Tenth People&#x27;s Hospital, School of Life Sciences and Technology, Tongji University, Shanghai, China."""
915,university,"""Hematology, Leiden University Medical Center, 2333 ZA Leiden, The Netherlands."""
916,private,"""\xe2\x80\x96Proteobotics SL, Spanish National Biotechnology Centre (CSIC), Darwin 3, 28049, Madrid, Spain."""
917,university,"""Infection and Immunity Program and Department of Biochemistry and Molecular Biology, Monash Biomedicine Discovery Institute, Monash University, Clayton, VIC, 3800, Australia. anthony.purcell@monash.edu."""
918,institute,"""UPSP EGEAL Institut Polytechnique LaSalle Beauvais, Beauvais, France."""
919,university,"""Department of Urology, School of Medicine, Keio University, Tokyo 160-8582, Japan."""
920,university,"""Department of Chemistry, University of Virginia, Charlottesville, Virginia 22908, USA."""
921,institute,"""Division of Vaccine and Infectious Diseases, Fred Hutchinson Cancer Research Center, Seattle, Washington, USA."""
922,university,"""Department of Molecular Cell Biology, Weizmann Institute of Science, Rehovot, Israel. Electronic address: yardena.samuels@weizmann.ac.il."""
923,university,"""Institute of Infection and Immunity, Cardiff University School of Medicine, Heath Park, Cardiff CF14 4XN, Wales, UK Human Immunology Section, Vaccine Research Center, National Institute of Allergy and Infectious Diseases, National Institutes of Health, Bethesda, MD 20892."""
924,university,"""Department of Medicine II, University of Freiburg, Freiburg, Germany."""
925,university,"""ARC Centre of Excellence in Advanced Molecular Imaging, Monash University, Clayton, Australia."""
926,hospital,"""Institute of Neuroscience and Department of Neurology of the Second Affiliated Hospital of Guangzhou Medical University, Key Laboratory of Neurogenetics and Channelopathies of Guangdong Province and the Ministry of Education of China, Guangzhou 510260, China."""
927,university,"""Department of Microbiology and Immunology, Peter Doherty Institute for Infection and Immunity, The University of Melbourne, Melbourne, VIC 3010, Australia."""
928,university,"""Department of Microbiology and Immunology, University of Oklahoma Health Sciences Center, Oklahoma City, OK, USA."""
929,private,"""Takara Shuzo Co., Ltd., Biotechnology Research Laboratories, SETA 3-4-1, OTSU, SHIGA, 520-21, Japan."""
930,university,"""Institut Cochin, Universit\xc3\xa9 Paris Descartes, CNRS (UMR 8104), D\xc3\xa9partement d&#x27;Immunologie, H\xc3\xb4pital Cochin, Paris, France. isabelle.bourgault@inserm.fr"""
931,institute,"""Microbiology and Tumorbiology Center, Karolinska Institute, Stockholm, Sweden. victor.levitsky@mtc.ki.se"""
932,hospital,"""Department of Medicine, Rhode Island Hospital and the Warren Alpert Medical School of Brown University, 432 Pierre M. Galletti Building, 55 Claverick Street, Providence, RI 02903, United States."""
933,university,"""Department of Microbiology, the University of North Carolina, Chapel Hill, North Carolina 27599, USA."""
934,university,"""Quantitative Biology Center, University of T\xc3\xbcbingen, T\xc3\xbcbingen, Germany."""
935,university,"""Institut f\xc3\xbcr Chemie/Biochemie, AG Strukturbiochemie, Freie Universit\xc3\xa4t Berlin, Takustrasse 6, 14195 Berlin, Germany."""
936,private,"""Laboratorio de Inmunobiolog\xc3\xada, Unidad de Investigaci\xc3\xb3n en Diferenciaci\xc3\xb3n Celular y C\xc3\xa1ncer. FES-Zaragoza, UNAM, M\xc3\xa9xico. mogl@servidor.unam.mx"""
937,hospital,"""Broad Institute of MIT and Harvard, Cambridge, MA, USA; Department of Medical Oncology, Dana-Farber Cancer Institute, Boston, MA, 02215, USA; Center for Cancer Immunology, Massachusetts General Hospital, Boston, MA, 02114, USA. Electronic address: nhacohen@mgh.harvard.edu."""
938,university,"""Cancer Center at Illinois, University of Illinois, Urbana, IL 61801."""
939,university,"""Department of Pathology, University of Massachusetts Medical School, Worcester, Massachusetts, USA."""
940,university,"""Institute of Virology, Technical University of Munich/Helmholtz Zentrum M\xc3\xbcnchen, Munich, Germany."""
941,hospital,"""The Children&#x27;s Hospital of Philadelphia, Division of Hematology , Philadelphia, Pennsylvania, USA ; Howard Hughes Medical Institute , Philadelphia, Pennsylvania, USA ; Department of Pediatrics, University of Pennsylvania, Perelman School of Medicine , Philadelphia, Pennsylvania, USA."""
942,university,"""Department of Molecular and Experimental Medicine, Scripps Research Institute, La Jolla, CA 92037, USA."""
943,university,"""The Jenner Institute, Nuffield Department of Medicine, University of Oxford, Oxford, United Kingdom Target Discovery Institute, Nuffield Department of Medicine, University of Oxford, Oxford, United Kingdom."""
944,hospital,"""Division of Neuropathology, Brigham and Women&#x27;s Hospital, Boston, MA, USA."""
945,private,"""Adaptive Biotechnologies, South San Francisco, California 94080, USA."""
946,university,"""Department of Pathology, Kaohsiung Medical University, Kaohsiung, Taiwan."""
947,institute,"""Molecular Immunogenetics and Vaccine Research Section, National Cancer Institute, National Institutes of Health, Bethesda MD 20892-1578, USA."""
948,institute,"""Structural Immunology Section, Laboratory of Immunogenetics, National Institute of Allergy and Infectious Diseases (NIAID), NIH, Rockville, MD 20852."""
949,university,"""School of Medicine, Cardiff University, Cardiff, UK."""
950,institute,"""Institute for Computational Biomedicine, Weill Cornell Medicine, New York, NY, USA."""
951,institute,"""NHC Key Laboratory of Medical Virology and Viral Diseases, National Institute for Viral Disease Control and Prevention, Chinese Center for Disease Control and Prevention, Beijing 102206, China."""
952,university,"""Institute of Biochemistry, University of Lausanne, Epalinges, Switzerland."""
953,university,"""Thumbay Institute for Precision Medicine, Gulf Medical University, Ajman, 4184, UAE."""
954,university,"""Department of Biochemistry, Rajendra Memorial Research Institute of Medical Sciences, Patna, India."""
955,university,"""Department of Oncology, Johns Hopkins University School of Medicine, Baltimore, Maryland 21287."""
956,university,"""Institute of Toxicology, Hannover Medical School, Carl-Neuberg-Str. 1, 30625 Hannover, Germany."""
957,university,"""Department of Surgery, Memorial Sloan Kettering Cancer Center, New York, NY, USA."""
958,university,"""the Infection and Immunity Program and Department of Biochemistry and Molecular Biology, Biomedicine Discovery Institute, and; the Australian Research Council Centre of Excellence for Advanced Molecular Imaging, Monash University, Clayton, Victoria 3800, Australia,; the Institute of Infection and Immunity, Cardiff University School of Medicine, Heath Park, Cardiff CF14 4XN, United Kingdom."""
959,university,"""Department of Pathology, Immunology and Laboratory Medicine, University of Florida College of Medicine, Gainesville, FL 32611, USA."""
960,university,"""Cardinal Bernardin Cancer Center, Loyola University of Chicago, Maywood, Illinois 60153, USA."""
961,institute,"""Biological Resources Branch, National Institute of Allergy and Infectious Diseases, National Institutes of Health, Bethesda, MD 20892."""
962,institute,"""Institute for Translational Vaccinology , Bilthoven , Netherlands."""
963,institute,"""Fred Hutchinson Cancer Research Center, Seattle, WA 98109, USA."""
964,institute,"""Centre for Virus Research, The Westmead Institute for Medical Research, Westmead, New South Wales, Australia eunok.lee@sydney.edu.au."""
965,university,"""Department of Microbiology and the Beirne Carter Center for Immunology Research, University of Virginia, Charlottesville 22901, USA."""
966,institute,"""QIMR Berghofer Centre for Immunotherapy and Vaccine Development and Translational and Human Immunology Laboratory, Infection and Inflammation Program, QIMR Berghofer Medical Research Institute, Herston, QLD, 4006, Australia."""
967,university,"""Harvard-MIT Division of Health Sciences and Technology, Harvard Medical School, Boston, Massachusetts, USA."""
968,university,"""Beirne Carter Center for Immunology Research, University of Virginia, Charlottesville 22901."""
969,private,"""Eli Lilly &amp; Co, Lilly Corporate Center, Indianapolis, IN, 46285, USA."""
970,institute,"""NRC Institute of Immunology FMBA of Russia, Moscow, Russia."""
971,university,"""Graduate Institute of Microbiology, College of Medicine, National Taiwan University, 7F, No. 1 Sec. 1 Jen-Ai Rd., Taipei, Taiwan."""
972,university,"""School of Medicine &amp; Institute of Laboratory Animal Sciences, Jinan University, Guangzhou 510000, China."""
973,university,"""Function Center, North Sichuan Medical College, 637100, Nanchong, Sichuan, China."""
974,institute,"""Laboratory of Tumor Immunology and Biology, National Cancer Institute, National Institutes of Health, Bethesda, MD 20892-1750, USA."""
975,university,"""Department of Computer Science, Metropolitan College, Boston University, Boston, MA, USA."""
976,university,"""Princess Margaret Cancer Center, University Health Network, Toronto, ON, Canada."""
977,university,"""Division of Medical Oncology, School of Medicine, University of Colorado, Aurora, Colorado."""
978,hospital,"""Department of Laboratory Medicine, Division of Clinical Microbiology, F68, Karolinska Institutet at Karolinska University Hospital Huddinge, S-141 86 Stockholm, Sweden."""
979,university,"""Olivia Newton-John Cancer Research Institute, and School of Cancer Medicine, La Trobe University, Heidelberg, VIC, 3084, Australia. weisan.chen@latrobe.edu.au."""
980,university,"""Department of Histology and Embryology, Hengyang Medical School, University of South China, Hengyang, Hunan, 421001, China."""
981,hospital,"""Department of Endocrinology and Metabolism, The Third People&#x27;s Hospital of Linyi, Linyi 276023, China."""
982,hospital,"""Department of Dermatology, University Hospital of Zurich, 8091 Zurich, Switzerland."""
983,hospital,"""Department of Obstetrics and Gynecology, University Hospital of T\xc3\xbcbingen , T\xc3\xbcbingen, Germany."""
984,hospital,"""Cardiff University School of Medicine, University Hospital, Heath Park, Cardiff, United Kingdom."""
985,institute,"""Division of Infectious Diseases and Immunology, Queensland Institute of Medical Research, Brisbane, Australia."""
986,private,"""Biotherapeutics and Translational Research, Pharmacokinetics, Dynamics &amp; Metabolism, Pfizer Global Research and Development, Sandwich, Kent, CT13-9NJ, UK. timothy.hickling@pfizer.com."""
987,institute,"""Vital IT, Swiss Institute of Bioinformatics, Quartier Sorge, B\xc3\xa2timent Amphip\xc3\xb4le, 1015, Lausanne, Switzerland."""
988,university,"""Department of Dermatology, Medical University of Vienna, Vienna, Austria."""
989,university,"""Department of Pathology and Laboratory Medicine, School of Medicine, University of California Irvine, Irvine, CA."""
990,institute,"""Laboratory of Molecular Structure, NIAID, National Institutes of Health, Bethesda, Maryland 20892."""
991,university,"""Department of Medicine, University of California-Los Angeles 90024, USA."""
992,university,"""Applied Bioinformatics, Department of Computer Science, Center for Bioinformatics, University of T\xc3\xbcbingen, 72076 T\xc3\xbcbingen, Germany."""
993,university,"""Department of Immunobiology, Faculty of Life Sciences and Medicine, King&#x27;s College London, London, U.K. dk480@cam.ac.uk."""
994,private,"""Immunocore Ltd., Abingdon, UK."""
995,institute,"""Ragon Institute of MGH, MIT and Harvard, Cambridge, MA 02139, USA; Basic Science Program, Frederick National Laboratory for Cancer Research in the Laboratory of Integrative Cancer Immunology, National Cancer Institute, Bethesda, MD 20892, USA."""
996,university,"""Department of Biology and Biotechnology &quot;C. Darwin&quot;, Sapienza University of Rome, Rome, Italy."""
997,university,"""Department of Molecular and Cellular Biochemistry, University of Kentucky, Lexington, KY 40506, USA."""
998,institute,"""Immunotherapy and Immunoprevention, German Cancer Research Center (DKFZ), Im Neuenheimer Feld 280, 69120 Heidelberg, Germany."""
999,university,"""W.M. Keck Laboratory for Structural Biology, University of Maryland Institute for Bioscience and Biotechnology Research, Rockville, MD, 20850, USA."""
1000,university,"""Howard Hughes Medical Institute, Stanford University School of Medicine, Stanford, United States."""
1001,institute,"""Laboratoire Cytokines et Immunologie des tumeurs Humaines, U487 Institut National de la Sant\xc3\xa9 et de la Recherche M\xc3\xa9dicale, Institut Gustave Roussy, F-94805 Villejuif, Cedex, France."""
1002,university,"""Institute of Immunology and Microbiology, Faculty of Health and Medical Sciences, University of Copenhagen, Copenhagen, Denmark."""
1003,hospital,"""Department of Pathology and Laboratory Medicine, Child and Family Research Institute, University of British Columbia and British Columbia Children&#x27;s Hospital, 4480 Oak St., Vancouver, British Columbia V6H 3V4, Canada."""
1004,hospital,"""Shenzhen Key Laboratory of Pathogen and Immunity, State Key Discipline of Infectious Disease, Shenzhen Third People&#x27;s Hospital, Shenzhen, China."""
1005,hospital,"""CIBERehd and Departments of Biochemistry/Microbiology and Hepatology, Vall d&#x27;Hebron Hospital, University Aut\xc3\xb2noma de Barcelona (UAB), Barcelona, Spain."""
1006,university,"""Division of Gastroenterology &amp; Hepatology, Department of Medicine, University of Colorado School of Medicine, Aurora, CO 80045."""
1007,institute,"""Broad Institute of MIT and Harvard, Cambridge, MA, USA. nhacohen@mgh.harvard.edu."""
1008,institute,"""Instituto de Parasitolog\xc3\xada y Biomedicina L\xc3\xb3pez Neyra (CSIC), Parque Tecnol\xc3\xb3gico de Ciencias de la Salud, Avda. del Conocimiento S/N, 18100 Armilla, Spain. concepcion.maranon@genyo.es"""
1009,university,"""Department of Opthalmology and Visual Science; and Department of Pediatrics, Infectious Diseases Division (RM), The University of Chicago, Chicago, Illinois, USA."""
1010,university,"""Biomedical Translational Research Institute, Jinan University, Guangzhou 510000, China."""
1011,institute,"""Koch Institute for Integrative Cancer Research, Massachusetts Institute of Technology, Cambridge, MA, 02142, USA. fwhite@mit.edu."""
1012,university,"""Division of Immunology, Department of Biology, Postbox M661, Universitatstrasse 10, University of Constance, Konstanz D-78457, Germany."""
1013,private,"""Fujian Key Laboratory of Translational Cancer Medicine, No. 420, Fuma Road, Jinan District, Fuzhou City, Fujian 350014, China."""
1014,university,"""Institut National de la Sant\xc3\xa9 et de la Recherche M\xc3\xa9dicale Unit\xc3\xa9 580, Universit\xc3\xa9 Ren\xc3\xa9 Descartes, Paris, France."""
1015,institute,"""Laboratory of Tumor Immunology and Biology, Center for Cancer Research, National Cancer Institute, NIH, Bethesda, Maryland 20892, USA."""
1016,institute,"""Division of Immunology, Aichi Cancer Center Research Institute, Nagoya, Japan. kkuzushi@aichi-cc.jp"""
1017,institute,"""Departamento de Biolog\xc3\xada Molecular, Instituto de Parasitolog\xc3\xada y Biomedicina L\xc3\xb3pez Neyra, CSIC, Calle Ventanilla 11, 18001-Granada, Spain."""
1018,university,"""The Broad Institute, Cambridge, MA 02142, USA; Harvard Medical School Department of Ophthalmology, Massachusetts Eye and Ear, Boston, MA 02114, USA."""
1019,institute,"""Surgery Branch, National Cancer Institute, National Institutes of Health, Bethesda, Maryland 20892, USA."""
1020,hospital,"""University Hospital T\xc3\xbcbingen, Institute of Pathology, Liebermeisterstr. 8, 72076 T\xc3\xbcbingen, Germany; German Cancer Consortium (DKTK) and German Cancer Research Center (DKFZ) partner site T\xc3\xbcbingen, Germany."""
1021,university,"""Department of Biochemistry and Molecular Biology, Monash University, Clayton, VIC 3800, Australia; Department of Biochemistry and Genetics, La Trobe Institute for Molecular Science, La Trobe University, Melbourne, VIC 3086, Australia. Electronic address: s.gras@latrobe.edu.au."""
1022,university,"""Cancer Immunotherapy Program, University of California, San Francisco, San Francisco, CA."""
1023,private,"""Ziegler Biosolutions, Fahrgasse 5, 79761 Waldshut-Tiengen, Germany. Electronic address: ziegler-biosolutions@gmx.de."""
1024,university,"""Department of Pediatrics and Department of Biological Chemistry and Molecular Pharmacology, Harvard Medical School, Boston, MA, 02115, USA. jwang@crystal.harvard.edu."""
1025,hospital,"""Department of Laboratory Research, Cantonal Hospital St Gall, Gallen, Switzerland."""
1026,university,"""Department of Paediatrics, University of Oxford, OX3 9DU Oxford, England, UK."""
1027,university,"""Department of Surgery, Cardinal Bernardin Cancer Center, Loyola University Chicago, Maywood, Illinois, USA; tspear@luc.edu."""
1028,university,"""Clinical and Experimental Sciences, Sir Henry Wellcome Laboratories, Faculty of Medicine, University of Southampton, Southampton, United Kingdom."""
1029,university,"""State Key Laboratory of Virology, Hubei Key Laboratory of Cell Homeostasis, Department of Biochemistry and Molecular Biology, College of Life Sciences, Wuhan University, Wuhan, Hubei, China."""
1030,private,"""Laboratoire d&#x27;Immunologie, G\xc3\xa9n\xc3\xa9thon, CNRS UMR 8115, 91002, Evry Cedex, France. davoust@genethon.fr"""
1031,university,"""Department of Microbiology and Immunology; Institute of Geriatric Immunology; School of Medicine, Jinan University, Guangzhou, China."""
1032,university,"""Department of Medicine, Division of Hematology and Medical Oncology, Weill Cornell Medicine, New York, NY, USA."""
1033,hospital,"""Center for Cancer Immune Therapy, Department of Hematology, Herlev Hospital, University of Copenhagen, Herlev, Denmark."""
1034,university,"""Guangdong Province Key Laboratory for Biotechnology Drug Candidates, School of Life Sciences and Biopharmaceutics, Guangdong Pharmaceutical University, Guangzhou, Guangdong 510006, P.R. China."""
1035,university,"""Department of Microbiology and Immunology, University of Melbourne, at the Peter Doherty Institute for Infection and Immunity, Melbourne, Victoria, Australia."""
1036,university,"""Department of Micro and Nanotechnology, Technical University of Denmark, Lyngby, Denmark."""
1037,university,"""Department of Molecular Immunology, Research Institute for Microbial Diseases, Osaka University, Suita, Japan."""
1038,university,"""Department of Surgery, Committees on Immunology, Molecular Medicine, and Genetics, Institute of Genomics and Systems Biology, and The College, The University of Chicago, Chicago, IL 60637, USA."""
1039,university,"""INSERM U 981, Gustave Roussy, Facult\xc3\xa9 de M\xc3\xa9decine, Univ. Paris-Sud, Universit\xc3\xa9 Paris-Saclay, 94805, Villejuif, France."""
1040,hospital,"""Immunology Service, San Carlos University Hospital, Madrid, Spain."""
1041,hospital,"""Renal Transplant Unit, Princess Alexandra Hospital, Brisbane 4102 QLD Australia."""
1042,university,"""Gynecological Medical Oncology Service, Department of Medicine, Memorial Sloan Kettering Cancer Center, 1275 York Avenue, New York, NY, 10065, USA. ocearbhr@mskcc.org."""
1043,university,"""Infection and Immunity Program and Department of Biochemistry and Molecular Biology, Biomedicine Discovery Institute, Monash University, Clayton, Victoria 3800, Australia."""
1044,hospital,"""Institute of Virology, University Hospital of Essen, University of Duisburg-Essen, Essen, Germany."""
1045,hospital,"""Department of Immunohematology and Blood Bank, University Hospital, Leiden, The Netherlands."""
1046,university,"""Theoretical Biology and Bioinformatics, Utrecht University, Utrecht, The Netherlands."""
1047,university,"""Laboratory of Molecular Immunology, Immunology Frontier Research Center, Osaka University, Suita, Japan."""
1048,university,"""Department of Clinical Microbiology and Immunology, Sackler School of Medicine, Tel Aviv University, Tel Aviv, Israel."""
1049,university,"""Department of Human Genetics, Radboud University Medical Center, Nijmegen, Netherlands."""
1050,university,"""Ludwig Institute for Cancer Research, University of Lausanne, Agora Center, Rue du Bugnon 25A, 1005, Lausanne, Switzerland."""
1051,university,"""Department of Hematology and Oncology, University of T\xc3\xbcbingen, T\xc3\xbcbingen, Germany."""
1052,university,"""School of Medicine, Nanjing University, Nanjing, 210093, China."""
1053,university,"""The Protein Crystallography Unit, Department of Biochemistry and Molecular Biology, School of Biomedical Sciences, Monash University, Clayton, Victoria 3800, Australia."""
1054,university,"""Department of Immunology, Institute for Cell Biology, University of T\xc3\xbcbingen, T\xc3\xbcbingen, Germany; German Cancer Research Center (DKFZ) partner site and German Cancer Consortium (DKTK) T\xc3\xbcbingen, T\xc3\xbcbingen, Germany."""
1055,institute,"""La Jolla Institute for Immunology, La Jolla, CA 92037; and."""
1056,institute,"""Division of Immunology, Aichi Cancer Center Research Center, Nagoya, Japan."""
