,type,affiliation
2487,university,"""Department of Medicine, University College Cork, Cork, Ireland."""
2488,hospital,"""Broad Institute of MIT and Harvard, Cambridge, MA, USA; Department of Medical Oncology, Dana-Farber Cancer Institute, Boston, MA, 02215, USA; Department of Medicine, Brigham and Women&#x27;s Hospital, Boston, MA, 02115, USA; Harvard Medical School, Boston, MA, 02115, USA. Electronic address: cwu@partners.org."""
2489,hospital,"""Department of Severe Tuberculosis Medicine, Guangzhou Chest Hospital, Guangzhou, China."""
2490,university,"""Medizinische Klinik II, Institut f\xc3\xbcr Zellbiologie, Eberhard-Karls-Universit\xc3\xa4t T\xc3\xbcbingen, T\xc3\xbcbingen, Germany."""
2491,university,"""Department of Microbiology, Yonsei University College of Medicine, Seoul, Korea."""
2492,university,"""Department of Applied Biosciences, Swiss Federal Institute of Technology, Wintherthurerstrasse 190, CH-8057 Z\xc3\xbcrich, Switzerland."""
2493,university,"""Institute for Immunity, Transplantation, and Infection, Stanford University School of Medicine, Stanford, CA 94305, USA."""
2494,hospital,"""Department of Pediatric Oncology, Sophia Children&#x27;s Hospital, Erasmus University Medical Center, Rotterdam, Netherlands."""
2495,institute,"""Division of Immune Regulation, La Jolla Institute for Immunology, La Jolla, CA, United States."""
2496,university,"""Department of Gastroenterology and Metabology, Graduate School of Medicine, Ehime University, Toh-on, Ehime, Japan."""
2497,hospital,"""Center for Genomic Medicine, Rigshospitalet, Copenhagen University Hospital, Copenhagen, Denmark. frederik.otzen.bagger@regionh.dk."""
2498,university,"""Department of Medical Microbiology, University of Mainz, Germany."""
2499,university,"""Department of Chemistry, Universit\xc3\xa9 de Montr\xc3\xa9al, PO Box 6128 Station Centre-Ville, Montreal, Quebec, Canada H3C 3J7."""
2500,hospital,"""Cellular Immunotherapy Program and Cancer Center, Massachusetts General Hospital, Charlestown, MA 02129, USA; Harvard Medical School, Boston, MA 02115, USA; Klarman Cell Observatory, Broad Institute of MIT and Harvard, Cambridge, MA 02139, USA; Department of Medicine, Massachusetts General Hospital, Boston, MA 02114, USA."""
2501,university,"""Institut f\xc3\xbcr Biochemie, Charit\xc3\xa9-Universit\xc3\xa4tsmedizin Berlin, 10117 Berlin, Germany. michele.mishto@charite.de j.liepe@imperial.ac.uk."""
2502,university,"""From the Division of Infection and Immunity and Systems Immunity Research Institute, Cardiff University School of Medicine, Heath Park, Cardiff CF14 4XN, United Kingdom coledk@cf.ac.uk."""
2503,hospital,"""Ragon Institute of MGH, MIT and Harvard, Cambridge, MA 02139, USA; Department of Pathology, Massachusetts General Hospital, MA 02115, USA."""
2504,university,"""Centre d&#x27;Immunologie de Marseille-Luminy, INSERM, CNRS, Aix-Marseille University, Marseille, France."""
2505,hospital,"""Department of Neurology, Guangzhou First People&#x27;s Hospital, School of Medicine, South China University of Technology, Guangzhou 510180, China."""
2506,institute,"""Division of Vaccine Discovery, La Jolla Institute for Allergy and Immunology, La Jolla, California, USA daniela@liai.org."""
2507,university,"""Department of Hematology and Hematopoietic Cell Transplantation, United States."""
2508,institute,"""Centre of Basic Research, Biomedical Research Foundation of the Academy of Athens, Athens 11527, Greece."""
2509,university,"""Department of Genome Medicine and Science, College of Medicine, Gachon University, Incheon, Republic of Korea."""
2510,university,"""Department of Biophysics and Biophysical Chemistry, Johns Hopkins University School of Medicine, Baltimore, Maryland 21205."""
2511,hospital,"""University Hospital T\xc3\xbcbingen, Institute of Pathology, Liebermeisterstr. 8, 72076 T\xc3\xbcbingen, Germany."""
2512,private,"""Tissue Typing and Immunogenetics Unit, Hadassah Medical Center, Jerusalem, Israel."""
2513,hospital,"""the Servicio de Inmunolog\xc3\xada, Hospital Universitario Virgen del Roc\xc3\xado (IBiS, CSIC, US), Sevilla 41013, Spain, and."""
2514,hospital,"""Center for Cancer Immune Therapy (CCIT), Department of Hematology, University Hospital Herlev, Herlev, Denmark."""
2515,university,"""Department of Immunology, Institute for Cell Biology, University of T\xc3\xbcbingen, 72076 T\xc3\xbcbingen, Germany; stefan.stevanovic@uni-tuebingen.de."""
2516,institute,"""CAS Key Laboratory of Pathogenic Microbiology and Immunology, Institute of Microbiology, Chinese Academy of Sciences, Beijing 100101, China."""
2517,university,"""QIMR Berghofer Medical Research Institute, Brisbane, Queensland 4029, Australia; School of Medicine, University of Queensland, Brisbane, Queensland 4072, Australia; Institute of Infection and Immunity, Cardiff University School of Medicine, Heath Park, Cardiff CF14 4XN, United Kingdom."""
2518,university,"""Department of Microbiology and Immunology, Yong Loo Lin School of Medicine, National University of Singapore, 5 Science Drive 2, Singapore, 119260, Singapore. ren_ee_chee@immunol.a-star.edu.sg."""
2519,institute,"""CAS Key Laboratory of Pathogenic Microbiology and Immunology, Institute of Microbiology, Chinese Academy of Sciences, Beijing, China."""
2520,university,"""Department of Microbiology and Immunology, City University of New York Medical School, New York, New York 10031, USA."""
2521,institute,"""Division of Vaccine Discovery, La Jolla Institute for Immunology, La Jolla, CA, USA."""
2522,institute,"""Institute for Translational Vaccinology , P.O. Box 450, 3720 AL Bilthoven, The Netherlands."""
2523,university,"""Infection and Immunity Program and Department of Biochemistry and Molecular Biology, Monash Biomedicine Discovery Institute, Monash University, Clayton, VIC, 3800, Australia. julian.vivian@monash.edu."""
2524,university,"""Department of Hematology, Leiden University Medical Center, Leiden 2333ZA, the Netherlands. Electronic address: m.h.meeuwsen@lumc.nl."""
2525,university,"""Institute of Infection and Immunity, Cardiff University School of Medicine, Heath Park, Cardiff, CF14 4XN, UK."""
2526,university,"""Rudolf Virchow Center for Experimental Biomedicine, Julius-Maximilians-Universit\xc3\xa4t W\xc3\xbcrzburg, W\xc3\xbcrzburg, Germany. Florian.Erhard@uni-wuerzburg.de Andreas.Schlosser@uni-wuerzburg.de."""
2527,hospital,"""Department of Clinical Molecular Biology, University of Oslo and Akershus University Hospital, L\xc3\xb8renskog, Norway."""
2528,university,"""Department of Biochemistry &amp; Microbiology, University of Victoria, Victoria, Canada."""
2529,university,"""Division of Infection and Immunity and Systems Immunity Research Institute, Cardiff University School of Medicine, Heath Park, Cardiff, United Kingdom."""
2530,institute,"""Institute of Biostructures and Biomaging (IBB), National Research Council, 80134, Naples, Italy."""
2531,institute,"""Cellular Immunology Laboratory, Queensland Institute of Medical Research and Australian Centre for Vaccine Development, Brisbane 4029, Australia."""
2532,private,"""Immunocore LTD, Oxford, United Kingdom."""
2533,university,"""Department of Molecular &amp; Experimental Medicine, The Scripps Research Institute, La Jolla, CA 92037, USA."""
2534,hospital,"""St Jude Proteomics Facility, St Jude Children&#x27;s Research Hospital, Memphis, Tennessee, 38105, USA."""
2535,university,"""Department of Pathology , Dalhousie University , Halifax , Nova Scotia B3H 4R2 , Canada."""
2536,hospital,"""Department of Dermatology, Venereology, and Allergology, University Hospital W\xc3\xbcrzburg, W\xc3\xbcrzburg, Germany."""
2537,university,"""Broad Institute of MIT and Harvard, Cambridge, MA 02142, USA; Translational Immunogenomics Laboratory, Dana-Farber Cancer Institute, Boston, MA, USA; Health Informatics Lab, Metropolitan College, Boston University, Boston, MA, USA; Department of Medical Oncology, Dana-Farber Cancer Institute, Boston, MA, USA."""
2538,university,"""Department of Translational Immunology, German Cancer Research Center (DKFZ), 69120 Heidelberg, Germany."""
2539,university,"""School of Computing Science, Simon Fraser University, Burnaby, Canada."""
2540,university,"""Indigenous Research Network, Griffith University, Brisbane, QLD, 4222, Australia."""
2541,university,"""Department of Translational Medical Science and European Laboratory for Investigation and Food-Induced Diseases, University Federico II, 80131 Naples, Italy; and."""
2542,private,"""Biotherapeutics and Translational Research, Pharmacokinetics, Dynamics &amp; Metabolism, Pfizer Global Research and Development, Sandwich, Kent, CT13-9NJ, UK. Rebecca.Platt@Covance.com."""
2543,university,"""Hangzhou Medical College, Hangzhou, China."""
2544,university,"""Department of Microbiology, Perelman School of Medicine, University of Pennsylvania, Philadelphia, PA, United States."""
2545,university,"""CRTD-DFG Research Center for Regenerative Therapies Dresden, Medical Faculty, Technische Universit\xc3\xa4t Dresden, Dresden, Germany."""
2546,private,"""German Center for Infection Research (DZIF), Partner Site Hannover-Braunschweig, Inhoffenstr. 7, 38124 Braunschweig, Germany."""
2547,private,"""Epimmune, Inc., San Diego, CA, USA."""
2548,university,"""Department of Biochemistry and Molecular Biology &amp; Infection and Immunity Program, Biomedicine Discovery Institute, Monash University, Clayton, VIC, Australia."""
2549,hospital,"""Tumour Immunology Group, Weatherall Institute of Molecular Medicine, University of Oxford, John Radcliffe Hospital, Oxford OX3 9DS, United Kingdom. corinna.mccarthy@imm.ox.ac.uk"""
2550,university,"""Department of Biochemistry, University of Illinois, Urbana, Illinois."""
2551,university,"""Institut f\xc3\xbcr Chemie und Biochemie, Abteilung Strukturbiochemie, Freie Universit\xc3\xa4t Berlin, Takustrasse 6, Berlin 14195, Germany. loll@chemie.fu-berlin.de"""
2552,university,"""Department of Microbiology and Immunology, Geisel School of Medicine at Dartmouth, Lebanon, NH 03755."""
2553,institute,"""CAS Key Laboratory of Pathogenic Microbiology and Immunology, Institute of Microbiology, Chinese Academy of Sciences (CAS), Beijing, China liujun@ivdc.chinacdc.cn mengsd@im.ac.cn."""
2554,university,"""Department of Microbiology and Immunology, Medical School of Southeast University, Nanjing, 210009, Jiangsu, China."""
2555,university,"""Center for Proteomics and Metabolomics, Leiden University Medical Center, Leiden 2333ZA, the Netherlands."""
2556,university,"""Laboratories of Experimental Immunology, University of Copenhagen, Copenhagen, Denmark."""
2557,hospital,"""Institute of Molecular Medicine, John Radcliffe Hospital, Oxford, UK."""
2558,hospital,"""Department of Internal Medicine, University Hospital Eppendorf, Hamburg, Germany."""
2559,private,"""NIHR Southampton BRC, UHS NHS FT, Southampton, United Kingdom."""
2560,university,"""Hope Clinic of the Emory Vaccine Center, Emory University School of Medicine, Atlanta, Georgia, United States of America; Division of Infectious Diseases School of Medicine, Emory University School of Medicine, Atlanta, Georgia, United States of America."""
2561,institute,"""Surgery Branch, National Cancer Institute, National Institutes of Health, Bethesda, MD 20892."""
2562,university,"""Gynecology Service, Department of Surgery, Memorial Sloan Kettering Cancer Center, New York, NY, USA."""
2563,institute,"""Research Unit of Adaptive Evolution and Control of Emerging Viruses (2018RU009), Chinese Academy of Medical Sciences, Beijing 102206, China."""
2564,private,"""Shanghai Key Laboratory of Hepatobiliary Tumor Biology (EHBH), Shanghai, 200438, China."""
2565,university,"""School of Dentistry and Jonsson Comprehensive Cancer Center, University of California Los Angeles, Los Angeles, California, United States of America."""
2566,university,"""Beijing Advanced Innovation Center for Structural Biology, Beijing Frontier Research Center for Biological Structure, MOE Key Laboratory of Bioorganic Phosphorus Chemistry &amp; Chemical Biology, School of Pharmaceutical Sciences, Tsinghua University, Beijing 100084, China; Tsinghua-Peking Center for Life Sciences, Beijing 100084, China."""
2567,university,"""Monash Proteomics &amp; Metabolomics Facility, Monash Biomedicine Discovery Institute, Monash University, Clayton, Victoria, Australia."""
2568,university,"""Institute of Infection and Immunity, Cardiff University School of Medicine, Heath Park, Cardiff, UK."""
2569,university,"""Howard Hughes Medical Institute, Stanford University School of Medicine, Stanford, CA, USA. kcgarcia@stanford.edu."""
2570,hospital,"""Sapporo Dohto Hospital, Sapporo, Japan."""
2571,university,"""Centre for Inflammation Biology and Cancer Immunology (CIBCI) &amp; Peter Gorer Department of Immunobiology, King&#x27;s College London, London, United Kingdom."""
2572,private,"""Agenus Inc., Lexington, KY, USA."""
2573,hospital,"""Kyoritsu Onsen Hospital, Hyogo, Japan."""
2574,institute,"""China Research Network of Immunity and Health, Beijing Institutes of Life Science Chinese Academy of Sciences, Beijing 100101, China."""
2575,institute,"""Liver Diseases Section, National Institute of Diabetes and Digestive and Kidney Diseases, National Institutes of Health, Bethesda, Maryland 20982, USA."""
2576,university,"""Institute for Immunology, University of California, Irvine, School of Medicine, Irvine, CA 92697."""
2577,university,"""Flow Cytometry Core Facility, Cardinal Bernardin Cancer Center, Loyola University Chicago, Maywood, Illinois, USA;"""
2578,university,"""4 Department of Obstetrics and Gynecology, Anhui Medical University , Hefei, China ."""
2579,institute,"""Instituto de Parasitolog\xc3\xada y Biomedicina L\xc3\xb3pez Neyra, Consejo Superior de Investigaciones Cient\xc3\xadficas (IPBLN-CSIC), PTS Granada, Avda. del Conocimiento S/N, 18016, Granada, Spain."""
2580,hospital,"""Institute of Molecular Medicine, University of Oxford, John Radcliffe Hospital, UK."""
2581,hospital,"""Department of Oncology, Herlev University Hospital, Copenhagen, Denmark."""
2582,university,"""School of Medicine, The University of Queensland, Brisbane, Queensland, Australia."""
2583,institute,"""Unit\xc3\xa9 d&#x27;Immunit\xc3\xa9 Cellulaire Antivirale, Institut Pasteur, 75724 Paris, C\xc3\xa9dex 15, France."""
2584,university,"""From the Departments of Immunohematology and Blood Transfusion and p.a.van_veelen@lumc.nl."""
2585,hospital,"""Translational Skin Cancer Research, University Hospital Essen and University of Duisburg-Essen, Essen, Germany."""
2586,university,"""Institute of Infection and Immunity, Cardiff University School of Medicine, Henry Wellcome Building, Heath Park, Cardiff CF14 4XN, Wales, United Kingdom."""
2587,university,"""Department of Microbiology and Immunology, Institute of Geriatric Immunology, School of Medicine, Jinan University, Guangzhou 510000, China."""
2588,university,"""Department of Microbiology, Hyogo Medical University, Hyogo, Japan."""
2589,university,"""Department of Biochemistry and Genetics, La Trobe Institute for Molecular Science, La Trobe University, Melbourne, Victoria, Australia."""
2590,university,"""Sorbonne Universit\xc3\xa9, INSERM, CNRS, Center for Immunology and Microbial Infections (CIMI-Paris), Paris, France."""
2591,hospital,"""Division of Gastroenterology, Department of Medicine, Taipei Veterans General Hospital, 201 Shih-Pai Road, Sec. 2, Taipei 112, Taiwan. yhhuang@vghtpe.gov.tw"""
2592,university,"""Department of Medical Oncology, Dana-Farber Cancer Institute, Boston, MA, 02215, USA; Harvard Medical School, Boston, MA, 02115, USA; Department of Computer Science, Metropolitan College, Boston University, Boston, MA, 02215, USA."""
2593,private,"""Assistance Publique H\xc3\xb4pitaux de Paris, Laboratoire d&#x27;Immunologie et Histocompatibilit\xc3\xa9, H\xc3\xb4pital Saint-Louis, Paris, France."""
2594,university,"""School of Pharmacy, University of Connecticut, Storrs, CT 06269, USA."""
2595,university,"""University of T\xc3\xbcbingen, Center for Bioinformatics, T\xc3\xbcbingen, Germany."""
2596,university,"""School of Health and Biomedical Science, RMIT University, Melbourne, VIC, Australia."""
2597,institute,"""Neuroimmunology Branch, National Institute of Neurological Disorders and Stroke, Bethesda, MD 20892, USA."""
2598,institute,"""Division of Immunology, Netherlands Cancer Institute, Amsterdam, Netherlands. johanna.olweus@medisin.uio.no t.schumacher@nki.nl."""
2599,hospital,"""Department of Clinical Immunology, Copenhagen University Hospital, Copenhagen, Denmark."""
2600,university,"""Department of Immunology, Institute for Cell Biology, Eberhard-Karls University T\xc3\xbcbingen, Germany."""
2601,private,"""Pure MHC LLC, Austin, Texas 78229, and."""
2602,institute,"""Malaria Program, Naval Medical Research Center, Silver Spring, MD 20910-7500, USA."""
2603,university,"""Dept. of Microbiology and Immunology, The University of Melbourne, Parkville, Victoria 3010, Australia."""
2604,institute,"""German Cancer Consortium of Translational Cancer Research (DKTK) and German Cancer Research Center (DKFZ), Heidelberg 69120, Germany."""
2605,university,"""Department of Chemistry, University of Virginia, Charlottesville, VA, 222904, USA."""
2606,hospital,"""Servicio de Inmunolog\xc3\xada, Hospital Cl\xc3\xadnico Universitario, Complejo Hospitalario Universitario de Santiago de Compostela (CHUS), Santiago de Compostela, Spain."""
2607,university,"""Emory Vaccine Center, Emory University School of Medicine, Atlanta, Georgia, United States of America; Department of Microbiology and Immunology, Emory University School of Medicine, Atlanta, Georgia, United States of America; Centre for Respiratory Infection, National Heart and Lung Institute, Imperial College London, London, United Kingdom."""
2608,university,"""Department of Medicine, College of Physicians and Surgeons, Columbia University, New York, New York 10032, USA."""
2609,university,"""Department of Pathology, Microbiology and Immunology, Vanderbilt University Medical Centre, Nashville, TN, USA."""
2610,institute,"""Swiss Institute of Bioinformatics, Quartier Sorge, B\xc3\xa2timent Amphip\xc3\xb4le, 1015, Lausanne, Switzerland."""
2611,university,"""Grupo de Ciencias B\xc3\xa1sicas M\xc3\xa9dicas, Facultad de Medicina, Universidad de los Andes, Carrera 1 No. 18A-10, Bogot\xc3\xa1 D.C., Colombia."""
2612,university,"""Department of Surgery, University of Maryland Medical Center, Baltimore, MD 21201, USA."""
2613,hospital,"""Laboratory of Immunology, Charles Nicolle Hospital, Tunis, Tunisia."""
2614,university,"""From the Centro de Biolog\xc3\xada Molecular Severo Ochoa (Consejo Superior de Investigaciones Cient\xc3\xadficas and Universidad Aut\xc3\xb3noma), 28049 Madrid, Spain."""
2615,university,"""Medical Department III, Hematology and Oncology , Munich, Germany."""
2616,university,"""Department of Thoracic and Cardiovascular Surgery, The University of Texas MD Anderson Cancer Center, Houston, Texas."""
2617,university,"""Department of Hematology, Leiden University Medical Center, 2300 RC Leiden, The Netherlands. p.hombrink@lumc.nl"""
2618,university,"""Department of Life Sciences Core Facilities, Weizmann Institute of Science, Rehovot, Israel."""
2619,private,"""Division of Pediatric Allergy-Immunology, National Jewish Health, Denver, CO, 80206, USA."""
2620,university,"""Department of Pathology, Sapporo Medical University School of Medicine, South-1 West-17, Chuo-Ku, Sapporo, Hokkaido, 060-8556, Japan."""
2621,university,"""Gene Therapy Center, University of North Carolina, Chapel Hill, NC 27599, USA."""
2622,private,"""Cell Therapy Service, Memorial Sloan Kettering Cancer Center, New York, NY, USA. klebanoc@mskcc.org."""
2623,university,"""Department of Microbiology, Hyogo Medical University, Hyogo, Japan. sh-ishido@hyo-med.ac.jp."""
2624,private,"""\xc2\xb6Netherlands Proteomics Centre, Padualaan 8, 3584 CH Utrecht, the Netherlands."""
2625,university,"""Department of Biology, Stanford University School of Humanities and Sciences, Stanford, CA 94305, USA."""
2626,university,"""Institute of Infection and Immunity, Cardiff University School of Medicine, Cardiff, UK."""
2627,hospital,"""GI Cancer Unit, The Royal Marsden Hospital, Fulham Road, London, SW3 6JJ, UK."""
2628,university,"""Infection and Immunity Program and Department of Biochemistry and Molecular Biology, Biomedicine Discovery Institute, Monash University, Clayton, Victoria, Australia; Australian Research Council Centre of Excellence for Advanced Molecular Imaging, Monash University, Clayton, Victoria, Australia. Electronic address: jan.petersen@monash.edu."""
2629,university,"""Systems Immunity Research Institute, Cardiff University School of Medicine, Cardiff, United Kingdom."""
2630,university,"""Department of Structural Biology, School of Medicine, Stanford University, Stanford, CA 94305, USA; Department of Microbiology &amp; Immunology, School of Medicine, Stanford University, Stanford, CA 94305, USA."""
2631,private,"""Genentech, Inc., South San Francisco, California, USA."""
2632,private,"""Ziegler Biosolutions, Waldshut-Tiengen, Germany."""
2633,hospital,"""3 Institute of Virology, University Hospital Freiburg , Freiburg, Germany ."""
2634,institute,"""NHC Key Laboratory of Biosafety, National Institute for Viral Disease Control and Prevention, Chinese Center for Disease Control and Prevention (China CDC), Beijing 100052, China."""
2635,university,"""Department of Oncology, Ludwig Institute for Cancer Research, University of Lausanne, Lausanne, Switzerland; Swiss Institute of Bioinformatics, Lausanne, Switzerland."""
2636,university,"""Department of Biomedical Sciences, University of Hull, Hull HU6 7RX, UK."""
2637,hospital,"""University Hospital T\xc3\xbcbingen, Institute of Medical Genetics and Applied Genomics, Calwerstr. 7, 72076 T\xc3\xbcbingen, Germany; German Cancer Consortium (DKTK) and German Cancer Research Center (DKFZ) partner site T\xc3\xbcbingen, Germany."""
2638,private,"""Division of Cancer Research, Peter MacCallum Cancer Centre, Melbourne, Victoria, Australia."""
2639,university,"""Department of Hematopoiesis, Sanquin Research and Landsteiner Laboratory, Amsterdam UMC, University of Amsterdam, 1066CX, Amsterdam, Netherlands."""
2640,university,"""NDM Research Building, Nuffield Department of Medicine, University of Oxford, Oxford, UK."""
2641,private,"""Singapore Immunology Network, Agency for Science, Technology and Research, Singapore 138648."""
2642,university,"""Department of Molecular and Experimental Medicine, Scripps Research Institute, La Jolla 92037."""
2643,university,"""Mechanisms of Disease and Translational Medicine, Department of Pathology, School of Medical Sciences, Faculty of Medicine, University of New South Wales, Sydney, Australia."""
2644,hospital,"""\xe2\x80\x96\xe2\x80\x96\xe2\x80\x96Region Hovedstaden (Center for Cancer Immune Therapy (CCIT), Herlev Hospital, Herlev Ringvej 75, DK-2730, Copenhagen, Denmark."""
2645,university,"""Department of Medicine (Division of Endocrinology), Albert Einstein College of Medicine, 1300 Morris Park Avenue, Bronx, NY, 10461, USA."""
2646,university,"""Faculty of Biology, University of Freiburg, Freiburg, Germany."""
2647,institute,"""Division of Cell Biology, The Netherlands Cancer Institute, 1066 CX Amsterdam, the Netherlands;"""
2648,university,"""Sydney Medical School, University of Sydney, Sydney, New South Wales, Australia."""
2649,university,"""Translational Hepatology Section, Liver Diseases Branch, National Institute of Diabetes and Digestive and Kidney Diseases, National Institutes of Health, US Department of Health and Human Services, Bethesda, Maryland."""
2650,institute,"""Division of Inflammation Biology, La Jolla Institute for Allergy and Immunology, La Jolla, CA, United States. Electronic address: sujan@lji.org."""
2651,hospital,"""Department of Microbiology and Immunology, School of Basic Medical Sciences, Wenzhou Medical University, Wenzhou, China; Department of Clinical Laboratory, The Second Affiliated Hospital &amp; Yuying Children&#x27;s Hospital of Wenzhou Medical University, Wenzhou, China."""
2652,private,"""Meng Yi Center Limited, Macau 999078, China."""
2653,hospital,"""Institute of Virology, University of Duisburg-Essen, University Hospital, Essen, Germany."""
2654,private,"""ImmunityBio, Inc, Culver City, California, USA."""
2655,university,"""Center for Translational Biomedical Research, University of North Carolina at Greensboro, North Carolina Research Campus, Kannapolis, North Carolina 28081, United States."""
2656,private,"""From the Division for Cell Biology and dzajonc@lji.org."""
2657,university,"""ARC Centre of Excellence in Advanced Molecular Imaging, Monash University, Clayton, Victoria 3800, Australia."""
2658,university,"""Division of Infection and Immunity, Cardiff University School of Medicine, Cardiff CF14 4XN, UK."""
2659,university,"""Faculty of Dentistry, McGill University, Montreal, Quebec, Canada."""
2660,university,"""Laboratory of Cellular and Molecular Immunology, Gavin Herbert Eye Institute, University of California Irvine, School of Medicine, Irvine, CA 92697; Department of Molecular Biology and Biochemistry, University of California Irvine, School of Medicine, Irvine, CA 92697; and Institute for Immunology, University of California Irvine, School of Medicine, Irvine, CA 92697 Lbenmoha@uci.edu."""
2661,hospital,"""Chris O&#x27;Brien Lifehouse Cancer Centre, Royal Prince Alfred Hospital, Sydney, NSW, Australia."""
2662,university,"""Institute for Research in Immunology and Cancer (IRIC), Universit\xc3\xa9 de Montr\xc3\xa9al, Montreal, QC H3C 3J7, Canada."""
